{
  "schema_version": 1,
  "graph_id": "cella-ensemble-pipeline",
  "revision": "sha256:dd9b803844e5384816049078e6b85c91538b524dc802c5b48b9825fe8abc22af",
  "direction": "from is the grammatical subject: from -relation-> to",
  "authority_policy": "All-families pipeline/orphan/ghost layer (non-DBP: precision-flow, GR, photonic, geometric-fault, cross-program). extensions.orphan flags proven-but-unpublished units; extensions.ghost flags natural continuations that do not exist yet. Additive source.",
  "nodes": [
    {
      "id": "GFL:cert:audit_mcd",
      "label": "Independent audit: mean-curvature decomposition",
      "type": "certificate",
      "claim_status": "machine-verified",
      "lifecycle_status": "released",
      "reachability": null,
      "tracked": false,
      "layer": "pipeline",
      "summary": "No-interaction claim CLEARED; flags a ~5.7e-7 engine bug.",
      "source_refs": [
        {
          "pointer": "cella:Papers_Library/05_expository_companions_and_research_maps/geometric_fault_localization_and_decomposition/Audit Report Mean Curvature Decomposition.md",
          "sha256": "b74ba861fd299eaf9858d5778c4dadfa56ba172f20609495e6bfbdaf1f140535"
        }
      ],
      "external_ids": {
        "PAP": [
          "PAP-0218"
        ]
      },
      "facets": {
        "subject_family": "geometric_fault_localization_and_decomposition",
        "pipeline_stage": "certificate"
      },
      "visual_hints": {},
      "extensions": {
        "orphan": false
      },
      "retrieval": {
        "key_terms": [],
        "context_priority": "normal",
        "retrieval_questions": [],
        "context_role": "supporting"
      }
    },
    {
      "id": "GFL:cert:foreign_arms",
      "label": "Cross-filed Arm I / Arm M ledgers + verdicts (foreign)",
      "type": "certificate",
      "claim_status": "machine-verified",
      "lifecycle_status": "released",
      "reachability": null,
      "tracked": false,
      "layer": "pipeline",
      "summary": "Arm I exact-account arithmetic + Arm M multivariate jets; only CL-M9 touches curvature. Re-homing candidate.",
      "source_refs": [
        {
          "pointer": "cella:Papers_Library/05_expository_companions_and_research_maps/geometric_fault_localization_and_decomposition/CLAIM_LEDGER.md",
          "sha256": "53a184afcbd27585b1fbb1c6691a7b518a9975c3ef270a5b325dacbc845e97eb"
        }
      ],
      "external_ids": {
        "PAP": [
          "PAP-0339"
        ]
      },
      "facets": {
        "subject_family": "geometric_fault_localization_and_decomposition",
        "pipeline_stage": "certificate"
      },
      "visual_hints": {},
      "extensions": {
        "orphan": false
      },
      "retrieval": {
        "key_terms": [],
        "context_priority": "normal",
        "retrieval_questions": [],
        "context_role": "supporting"
      }
    },
    {
      "id": "GFL:cert:integration_cwru",
      "label": "Decomposition integration report (138 surfaces + CWRU)",
      "type": "certificate",
      "claim_status": "demonstrated",
      "lifecycle_status": "released",
      "reachability": null,
      "tracked": false,
      "layer": "pipeline",
      "summary": "Decomposition verified on 17+29 surfaces and CWRU bearing faults.",
      "source_refs": [
        {
          "pointer": "cella:Papers_Library/05_expository_companions_and_research_maps/geometric_fault_localization_and_decomposition/decomposition_integration_report.md",
          "sha256": "45510586d1f07b564f7ef3eb4061e384aae7bf2db7df80ab7663fcd2e14d93ee"
        }
      ],
      "external_ids": {
        "PAP": [
          "PAP-0217"
        ]
      },
      "facets": {
        "subject_family": "geometric_fault_localization_and_decomposition",
        "pipeline_stage": "certificate"
      },
      "visual_hints": {},
      "extensions": {
        "orphan": false
      },
      "retrieval": {
        "key_terms": [],
        "context_priority": "normal",
        "retrieval_questions": [],
        "context_role": "supporting"
      }
    },
    {
      "id": "GFL:cert:shape_cluster",
      "label": "Shape-readout certificates (stages, preregs, witness battery, ledger)",
      "type": "certificate",
      "claim_status": "machine-verified",
      "lifecycle_status": "released",
      "reachability": null,
      "tracked": false,
      "layer": "pipeline",
      "summary": "Stage A/F3/F4/3b.3/WALL_SCOUT preregs+reports; witness gate x2 replay; append-only claim ledger.",
      "source_refs": [
        {
          "pointer": "cella:Papers_Library/05_expository_companions_and_research_maps/geometric_fault_localization_and_decomposition/FLAGSHIP_STAGE_A_PREREG.md",
          "sha256": "d5e69a10fee4897d2510d4aa89e8db2f451e2e1983c530f8862a3fed4285985f"
        }
      ],
      "external_ids": {
        "PAP": [
          "PAP-0359"
        ]
      },
      "facets": {
        "subject_family": "geometric_fault_localization_and_decomposition",
        "pipeline_stage": "certificate"
      },
      "visual_hints": {},
      "extensions": {
        "orphan": false
      },
      "retrieval": {
        "key_terms": [],
        "context_priority": "normal",
        "retrieval_questions": [],
        "context_role": "supporting"
      }
    },
    {
      "id": "GFL:conj:af_engagement",
      "label": "Alexandrov-Fenchel engagement (kint^2>=4 kc ks)",
      "type": "theorem",
      "claim_status": "conjectured",
      "lifecycle_status": "proposed",
      "reachability": null,
      "tracked": false,
      "layer": "pipeline",
      "summary": "Hypothesized inequality; attribution retired; do not implement until derived.",
      "source_refs": [
        {
          "pointer": "cella:Papers_Library/06_hypotheses_conjectures_and_research_programs/geometric_fault_localization_and_decomposition/Alexandrov-Fenchel Engagement.md",
          "sha256": "9a0147015ffc1564426acef156c676d593cb5e77062ef71ef60aec6f18668819"
        }
      ],
      "external_ids": {
        "PAP": [
          "PAP-0239"
        ]
      },
      "facets": {
        "subject_family": "geometric_fault_localization_and_decomposition",
        "pipeline_stage": "conjecture"
      },
      "visual_hints": {},
      "extensions": {
        "orphan": true
      },
      "retrieval": {
        "key_terms": [],
        "context_priority": "high",
        "retrieval_questions": [],
        "context_role": "supporting"
      }
    },
    {
      "id": "GFL:conj:dual_confinement",
      "label": "Dual Confinement",
      "type": "theorem",
      "claim_status": "conjectured",
      "lifecycle_status": "proposed",
      "reachability": null,
      "tracked": false,
      "layer": "pipeline",
      "summary": "Low-rank H_s/H_c confines curvature to lower floors; first testable at n=4.",
      "source_refs": [
        {
          "pointer": "cella:Papers_Library/02_theorems_and_lemmas/geometric_fault_localization_and_decomposition/Dual Confinement.md",
          "sha256": "94a9f85bea9646af28eea79df36dd65e999c43ecbdc82e16c86c4a0644411925"
        }
      ],
      "external_ids": {
        "PAP": [
          "PAP-0225"
        ]
      },
      "facets": {
        "subject_family": "geometric_fault_localization_and_decomposition",
        "pipeline_stage": "conjecture"
      },
      "visual_hints": {},
      "extensions": {
        "orphan": true
      },
      "retrieval": {
        "key_terms": [],
        "context_priority": "high",
        "retrieval_questions": [],
        "context_role": "supporting"
      }
    },
    {
      "id": "GFL:conj:essdim",
      "label": "Essential Dimension Conjecture ('if' proved; 'only if' refuted)",
      "type": "theorem",
      "claim_status": "demonstrated",
      "lifecycle_status": "active",
      "reachability": null,
      "tracked": false,
      "layer": "pipeline",
      "summary": "K=0 <-> ess.dim<n; cone (D-12) falsifies 'only if' (ruled surfaces); needs restatement.",
      "source_refs": [
        {
          "pointer": "cella:Papers_Library/06_hypotheses_conjectures_and_research_programs/geometric_fault_localization_and_decomposition/Essential Dimension Conjecture.md",
          "sha256": "4d1374cefc151f77b293cd61cca15ee28c4f3395a4d9832d1e90dcb4182f76f6"
        }
      ],
      "external_ids": {
        "PAP": [
          "PAP-0237"
        ]
      },
      "facets": {
        "subject_family": "geometric_fault_localization_and_decomposition",
        "pipeline_stage": "conjecture"
      },
      "visual_hints": {},
      "extensions": {
        "orphan": true
      },
      "retrieval": {
        "key_terms": [],
        "context_priority": "high",
        "retrieval_questions": [],
        "context_role": "supporting"
      }
    },
    {
      "id": "GFL:conj:essdim_af",
      "label": "Essential-dimension collapse at AF saturation",
      "type": "theorem",
      "claim_status": "conjectured",
      "lifecycle_status": "proposed",
      "reachability": null,
      "tracked": false,
      "layer": "pipeline",
      "summary": "kc=ks, ess.dim 3->1, Delta_AF=0 coincide on one S3 surface; single-instance.",
      "source_refs": [
        {
          "pointer": "cella:Papers_Library/06_hypotheses_conjectures_and_research_programs/geometric_fault_localization_and_decomposition/Essential Dimension Collapse at AF Saturation.md",
          "sha256": "1ac3c535c9fb7dbbe6c33c54b5c62d0c9fd58c51277005b8acd3fbd2b8b3049a"
        }
      ],
      "external_ids": {
        "PAP": [
          "PAP-0246"
        ]
      },
      "facets": {
        "subject_family": "geometric_fault_localization_and_decomposition",
        "pipeline_stage": "conjecture"
      },
      "visual_hints": {},
      "extensions": {
        "orphan": true
      },
      "retrieval": {
        "key_terms": [],
        "context_priority": "high",
        "retrieval_questions": [],
        "context_role": "supporting"
      }
    },
    {
      "id": "GFL:conj:grad_focusing",